{
  "$schema": "http://json-schema.org/draft-07/schema#",
  "title": "BreakingChanges",
  "description": "Array of breaking changes extracted from a library migration guide",
  "type": "array",
  "items": {
    "type": "object",
    "required": ["id", "title", "description", "detection", "fix", "source"],
    "additionalProperties": false,
    "properties": {
      "id": {
        "type": "string",
        "pattern": "^bc-\\d{3}$",
        "description": "Unique identifier, e.g. bc-001"
      },
      "title": {
        "type": "string",
        "minLength": 3,
        "description": "Short human-readable title matching the guide section heading"
      },
      "description": {
        "type": "string",
        "minLength": 10,
        "description": "What changed, why it breaks, and any relevant context"
      },
      "detection": {
        "type": "object",
        "required": ["pattern", "note"],
        "additionalProperties": false,
        "properties": {
          "pattern": {
            "type": "string",
            "description": "JavaScript-compatible regex string (no surrounding slashes) to grep/AST-search old API usage in source files"
          },
          "selector": {
            "type": "string",
            "description": "Optional CSS or XPath selector if detection is DOM-based"
          },
          "note": {
            "type": "string",
            "description": "Plain-English description of what to search for"
          }
        }
      },
      "fix": {
        "type": "object",
        "required": ["before", "after"],
        "additionalProperties": false,
        "properties": {
          "before": {
            "type": "string",
            "description": "Code snippet using the OLD (Express 4) API"
          },
          "after": {
            "type": "string",
            "description": "Code snippet using the NEW (Express 5) API"
          },
          "notes": {
            "type": "string",
            "description": "Optional caveats, edge cases, or additional migration steps"
          }
        }
      },
      "source": {
        "type": "string",
        "description": "Section heading or URL anchor in the migration guide where this change is documented"
      }
    }
  }
}
